{
  "$schema": "https://json-schema.org/draft/2020-12/schema",
  "type": "object",
  "required": ["id", "role", "prompt_template"],
  "properties": {
    "id": {"type": "string"},
    "name": {"type": "string"},
    "role": {"type": "string"},
    "prompt_template": {"type": "string"}
  }
}
