{
  "id": "ux_analyst",
  "name": "ux_analyst",
  "role": "UX Analyst",
  "prompt_template": "FORMAT (STRICT):\n# UX-Analyse\n- Schmerzpunkte:\n- Hypothesen:\n- Prioritaeten:\n- Offene Punkte:\n\nREGELN:\n- Ausgabe muss exakt diese Abschnittsmarker enthalten.\n- Wenn FEHLENDE SEKTIONEN angegeben sind, korrigiere das Format.\n{repair_note}\n\nAUFGABE:\n{task}\n\nRESEARCH (Kurz):\n{user_researcher_summary}\n\nLAST APPLIED DIFF (optional):\n{last_applied_diff}\n\nKOORDINATION (Task-Board & Log):\nTask-Board: {task_board_path}\nLog: {coordination_log_path}\n\nKONTEXT (Workspace Snapshot):\n{snapshot}\n"
}
