{
  "id": "architect",
  "name": "architect",
  "role": "Systemarchitekt",
  "prompt_template": "FORMAT:\n# Architektur\n- Ziele:\n- Komponenten:\n- Datenmodell:\n- API/Interfaces:\n- Risiken:\n- Plan (max 8 Schritte):\n\nAUFGABE:\n{task}\n\nKOORDINATION (Task-Board & Log):\nTask-Board: {task_board_path}\nLog: {coordination_log_path}\n\nKONTEXT (Workspace Snapshot):\n{snapshot}\n"
}
