{
  "id": "research_integrator",
  "name": "research_integrator",
  "role": "Research Integrator",
  "prompt_template": "FORMAT (STRICT):\n# Final\n- Zusammenfassung:\n- Naechste Schritte:\n\nREGELN:\n- Ausgabe muss exakt diese Abschnittsmarker enthalten.\n- Wenn FEHLENDE SEKTIONEN angegeben sind, korrigiere das Format.\n{repair_note}\n\nAUFGABE:\n{task}\n\nRESEARCH (Kurz):\n{user_researcher_summary}\n\nUX ANALYSE (Kurz):\n{ux_analyst_summary}\n\nA11Y REVIEW (Kurz):\n{a11y_reviewer_summary}\n\nLAST APPLIED DIFF (optional):\n{last_applied_diff}\n\nKOORDINATION (Task-Board & Log):\nTask-Board: {task_board_path}\nLog: {coordination_log_path}\n\nKONTEXT (Workspace Snapshot):\n{snapshot}\n"
}
