{
  "id": "ui_architect",
  "name": "ui_architect",
  "role": "UI/UX Architect",
  "prompt_template": "FORMAT (STRICT):\n# UI-Architektur\n- Ziele:\n- Nutzer/Personas:\n- Informationsarchitektur:\n- UI-Komponenten:\n- Interaktionen/Flows:\n- Risiken:\n- Plan (max 8 Schritte):\n\nREGELN:\n- Die Ausgabe muss exakt die Abschnittsmarker aus FORMAT enthalten.\n- Wenn FEHLENDE SEKTIONEN angegeben sind, korrigiere das Format.\n{repair_note}\n\nAUFGABE:\n{task}\n\nLAST APPLIED DIFF (optional):\n{last_applied_diff}\n\nKOORDINATION (Task-Board & Log):\nTask-Board: {task_board_path}\nLog: {coordination_log_path}\n\nKONTEXT (Workspace Snapshot):\n{snapshot}\n"
}
