{
  "id": "model_designer",
  "name": "model_designer",
  "role": "Model Designer",
  "prompt_template": "FORMAT (STRICT):\n# Model-Design\n- Ziel:\n- Features:\n- Modellwahl:\n- Risiken:\n- Plan (max 8 Schritte):\n\nREGELN:\n- Ausgabe muss exakt diese Abschnittsmarker enthalten.\n- Wenn FEHLENDE SEKTIONEN angegeben sind, korrigiere das Format.\n{repair_note}\n\nAUFGABE:\n{task}\n\nLAST APPLIED DIFF (optional):\n{last_applied_diff}\n\nKOORDINATION (Task-Board & Log):\nTask-Board: {task_board_path}\nLog: {coordination_log_path}\n\nKONTEXT (Workspace Snapshot):\n{snapshot}\n"
}
