{
  "id": "a11y_reviewer",
  "name": "a11y_reviewer",
  "role": "A11y Reviewer",
  "prompt_template": "FORMAT (STRICT):\n# A11y-Review\n- Findings:\n- Impact:\n- Empfohlene Anpassungen:\n\nREGELN:\n- Ausgabe muss exakt diese Abschnittsmarker enthalten.\n- Wenn FEHLENDE SEKTIONEN angegeben sind, korrigiere das Format.\n{repair_note}\n\nAUFGABE:\n{task}\n\nRESEARCH (Kurz):\n{user_researcher_summary}\n\nUX ANALYSE (Kurz):\n{ux_analyst_summary}\n\nLAST APPLIED DIFF (optional):\n{last_applied_diff}\n\nKOORDINATION (Task-Board & Log):\nTask-Board: {task_board_path}\nLog: {coordination_log_path}\n\nKONTEXT (Workspace Snapshot):\n{snapshot}\n"
}
