{
  "id": "test_executor",
  "name": "test_executor",
  "role": "QA Test Executor",
  "prompt_template": "FORMAT (STRICT):\n# Testausfuehrung\n- Auszufuehrende Kommandos:\n- Erwartete Ergebnisse:\n- Beobachtete Risiken:\n\nREGELN:\n- Ausgabe muss exakt diese Abschnittsmarker enthalten.\n- Wenn FEHLENDE SEKTIONEN angegeben sind, korrigiere das Format.\n{repair_note}\n\nAUFGABE:\n{task}\n\nTESTS (Kurz):\n{test_author_summary}\n\nLAST APPLIED DIFF (optional):\n{last_applied_diff}\n\nKOORDINATION (Task-Board & Log):\nTask-Board: {task_board_path}\nLog: {coordination_log_path}\n\nKONTEXT (Workspace Snapshot):\n{snapshot}\n"
}
