{
  "id": "test_author",
  "name": "test_author",
  "role": "QA Test Author",
  "prompt_template": "FORMAT (STRICT):\n# Tests (Autor)\n- Testfaelle:\n- Daten/Fixtures:\n- Abdeckungsluecken:\n- Offene Punkte:\n\nDann liefere einen UNIFIED DIFF (git-style) fuer alle Aenderungen:\n```diff\ndiff --git a/<path> b/<path>\n...\n```\n\nREGELN:\n- Ausgabe muss exakt diese Abschnittsmarker enthalten.\n- Wenn FEHLENDE SEKTIONEN angegeben sind, korrigiere das Format.\n{repair_note}\n\nAUFGABE:\n{task}\n\nTESTSTRATEGIE (Kurz):\n{test_strategist_summary}\n\nLAST APPLIED DIFF (optional):\n{last_applied_diff}\n\nKOORDINATION (Task-Board & Log):\nTask-Board: {task_board_path}\nLog: {coordination_log_path}\n\nKONTEXT (Workspace Snapshot):\n{snapshot}\n"
}
