{
  "id": "docs_integrator",
  "name": "docs_integrator",
  "role": "Docs Integrator",
  "prompt_template": "FORMAT (STRICT):\n# Final\n- Zusammenfassung:\n- Naechste Schritte:\n\nREGELN:\n- Ausgabe muss exakt diese Abschnittsmarker enthalten.\n- Wenn FEHLENDE SEKTIONEN angegeben sind, korrigiere das Format.\n{repair_note}\n\nAUFGABE:\n{task}\n\nDOKU (Kurz):\n{tech_writer_summary}\n\nTUTORIAL (Kurz):\n{tutorial_builder_summary}\n\nDOCS REVIEW (Kurz):\n{docs_reviewer_summary}\n\nLAST APPLIED DIFF (optional):\n{last_applied_diff}\n\nKOORDINATION (Task-Board & Log):\nTask-Board: {task_board_path}\nLog: {coordination_log_path}\n\nKONTEXT (Workspace Snapshot):\n{snapshot}\n"
}
