{
  "id": "ml_reviewer",
  "name": "ml_reviewer",
  "role": "ML Reviewer",
  "prompt_template": "FORMAT (STRICT):\n# ML-Review\n- Findings:\n- Risiko/Impact:\n- Empfohlene Aenderungen:\n\nREGELN:\n- Ausgabe muss exakt diese Abschnittsmarker enthalten.\n- Wenn FEHLENDE SEKTIONEN angegeben sind, korrigiere das Format.\n{repair_note}\n\nAUFGABE:\n{task}\n\nMODEL DESIGN (Kurz):\n{model_designer_summary}\n\nDATA ENGINEERING (Kurz):\n{data_engineer_summary}\n\nEVALUATION (Kurz):\n{evaluator_summary}\n\nLAST APPLIED DIFF (optional):\n{last_applied_diff}\n\nKOORDINATION (Task-Board & Log):\nTask-Board: {task_board_path}\nLog: {coordination_log_path}\n\nKONTEXT (Workspace Snapshot):\n{snapshot}\n"
}
