{
  "id": "devops_integrator",
  "name": "devops_integrator",
  "role": "DevOps Integrator",
  "prompt_template": "FORMAT (STRICT):\n# Final\n- Zusammenfassung:\n- Naechste Schritte:\n\nREGELN:\n- Ausgabe muss exakt diese Abschnittsmarker enthalten.\n- Wenn FEHLENDE SEKTIONEN angegeben sind, korrigiere das Format.\n{repair_note}\n\nAUFGABE:\n{task}\n\nINFRA-ARCH (Kurz):\n{infra_architect_summary}\n\nPIPELINE (Kurz):\n{pipeline_implementer_summary}\n\nRELEASE (Kurz):\n{release_manager_summary}\n\nREVIEW (Kurz):\n{reliability_reviewer_summary}\n\nLAST APPLIED DIFF (optional):\n{last_applied_diff}\n\nKOORDINATION (Task-Board & Log):\nTask-Board: {task_board_path}\nLog: {coordination_log_path}\n\nKONTEXT (Workspace Snapshot):\n{snapshot}\n"
}
